{
    "name":  "nfg2-depth-3",
    "carrier":  [
                    "T",
                    "a1",
                    "a2",
                    "a3",
                    "a4",
                    "s"
                ],
    "order":  [
                  [
                      "T",
                      "T"
                  ],
                  [
                      "a1",
                      "a1"
                  ],
                  [
                      "a2",
                      "a2"
                  ],
                  [
                      "a3",
                      "a3"
                  ],
                  [
                      "a4",
                      "a4"
                  ],
                  [
                      "s",
                      "s"
                  ],
                  [
                      "s",
                      "a4"
                  ]
              ],
    "top":  "T",
    "bottom":  "s",
    "box":  {
                "T":  "T",
                "a1":  "a1",
                "a2":  "a2",
                "a3":  "a3",
                "a4":  "a4",
                "s":  "s"
            },
    "refutability":  {
                         "T":  "a1",
                         "a1":  "a2",
                         "a2":  "a3",
                         "a3":  "a4",
                         "a4":  "s",
                         "s":  "s"
                     },
    "metadata":  {
                     "purpose":  "Arbitrary-depth nFG2 first-true witness: nFG2(k) fails for k \u003c= 3 and holds at k = 4.",
                     "construction":  "Orbit T -\u003e a1 -\u003e ... -\u003e a4 -\u003e s -\u003e s, with the only non-reflexive order s \u003c= a4.",
                     "first_true_nFG2":  4,
                     "expected_nFG2_prefix":  "FFFTTTT",
                     "collapse":  false,
                     "G2_mode":  "vacuous",
                     "note":  "The model is intentionally sparse; antitonicity is forced only by s \u003c= a4, whose image condition is s \u003c= s."
                 }
}
