{
  "name": "bottom-G2FG2-noFP",
  "carrier": [
    "b",
    "d",
    "a",
    "T",
    "U"
  ],
  "order": [
    [
      "b",
      "b"
    ],
    [
      "d",
      "d"
    ],
    [
      "a",
      "a"
    ],
    [
      "T",
      "T"
    ],
    [
      "U",
      "U"
    ],
    [
      "b",
      "d"
    ],
    [
      "b",
      "a"
    ],
    [
      "b",
      "T"
    ],
    [
      "b",
      "U"
    ],
    [
      "d",
      "a"
    ],
    [
      "d",
      "U"
    ],
    [
      "a",
      "U"
    ],
    [
      "T",
      "U"
    ]
  ],
  "top": "T",
  "bottom": "b",
  "box": {
    "b": "b",
    "d": "d",
    "a": "a",
    "T": "T",
    "U": "U"
  },
  "refutability": {
    "b": "U",
    "d": "a",
    "a": "d",
    "T": "a",
    "U": "b"
  },
  "metadata": {
    "purpose": "Bottom-disciplined finite preAPS witness for G2+FG2 without syntactic boxtimes fixed point.",
    "order_summary": "b is least, U is greatest; d < a; T is incomparable with a and d except b < T < U.",
    "separation": "witnesses (G2=true, FG2=true, FP-synt=false) under bottom discipline",
    "bottom_discipline": true,
    "syntactic_FP": [],
    "nFG2_pattern": "TFTFTFTF",
    "boxtimes_orbit_T": [
      "T",
      "a",
      "d",
      "a",
      "d"
    ],
    "G2_antecedent": false,
    "G2_mode": "vacuous",
    "collapse": false,
    "note": "FG2 holds because boxtimes^2(T)=d <= a=boxtimes(T), while a and d form a strict 2-cycle rather than an equivalence."
  }
}
